MCQ,Choices,Correct
Who coined the term machine learning in 1959?,a: Donald Hebb | b: Raytheon Company | c: Arthur Samuel | d: Tom M. Mitchell,c
What book did Donald Hebb publish in 1949?,a: The Organization of Behavior | b: Learning Machines | c: Computing Machinery and Intelligence | d: The Organization of AI,a
What was Cybertron developed by Raytheon Company used for?,a: Analyzing sonar signals | b: Playing checkers | c: Recognizing patterns | d: Training neural networks,a
What is the main purpose of modern-day machine learning algorithms?,a: To classify data and make predictions | b: To play computer games | c: To communicate data | d: To study human cognitive processes,a
"According to Tom M. Mitchell, what does a computer program do in machine learning?",a: It learns from experience and improves performance | b: It generates random data | c: It analyzes human cognitive processes | d: It predicts future outcomes based on models,a
